,chapter,text,mask_sent,char,mfd2,mfd_word
139,9,finally one big mouse spoke.is anything one big mouse one big mouse ask repay scarecrow save life one big mouse 's queennothing scarecrow know answer scarecrow,finally one big mouse spoke.is anything one big mouse one big mouse ask repay [unused1] save life one big mouse 's queennothing [unused1] know answer [unused1],[unused1],fairness.virtue,repay
140,9,scarecrowthe scarecrow 's say quickly oh yes,[unused1]the [unused1] 's say quickly oh yes,[unused1],X,X
141,9,scarecrow save one big mouse 's friend cowardly lion asleep poppy bed.a lion cry little gray field mouse,[unused1] save one big mouse 's friend cowardly lion asleep poppy bed.a lion cry little gray field mouse,[unused1],care.vice,"crying,cries"
142,9,friend cowardly lion asleep poppy bed would eat scarecrow up.oh declare scarecrow,friend cowardly lion asleep poppy bed would eat [unused1] up.oh declare [unused1],[unused1],X,X
143,9,scarecrow help one big mouse save friend cowardly lion asleep poppy bed scarecrow promise friend cowardly lion asleep poppy bed shall treat scarecrow kindness.very well say little gray field mouse scarecrow trust scarecrow,[unused1] help one big mouse save friend cowardly lion asleep poppy bed [unused1] promise friend cowardly lion asleep poppy bed shall treat [unused1] kindness.very well say little gray field mouse [unused1] trust [unused1],[unused1],"fairness.virtue,care.virtue","help,trust,helps,trusts"
144,9,soon thousand hear little gray field mouse 's order thousand run away every direction fast possible.now say scarecrow scarecrow scarecrow must go tree riverside make truck carry friend cowardly lion asleep poppy bed.so scarecrow go tree riverside begin work,soon thousand hear little gray field mouse 's order thousand run away every direction fast possible.now say [unused1] [unused1] [unused1] must go tree riverside make truck carry friend cowardly lion asleep poppy bed.so [unused1] go tree riverside begin work,[unused1],"authority.virtue,authority.vice","order,orders"
145,9,scarecrow soon make truck limb tree scarecrow chop away leave branch,[unused1] soon make truck limb tree [unused1] chop away leave branch,[unused1],X,X
146,9,scarecrow fasten truck together wooden peg make four wheel short piece big tree trunk,[unused1] fasten truck together wooden peg make four wheel short piece big tree trunk,[unused1],loyalty.virtue,together
147,9,scarecrow tell dorothy everything turn dignified little mouse scarecrow said.permit scarecrow introduce dignified little mouse little gray field mouse.dorothy nod gravely little gray field mouse make curtsy little gray field mouse become quite friendly girl.the scarecrow scarecrow begin fasten several mouse truck use string several mouse bring,[unused1] tell dorothy everything turn dignified little mouse [unused1] said.permit [unused1] introduce dignified little mouse little gray field mouse.dorothy nod gravely little gray field mouse make curtsy little gray field mouse become quite friendly girl.the [unused1] [unused1] begin fasten several mouse truck use string several mouse bring,[unused1],sanctity.virtue,dignified
148,9,dorothy grow fond friend cowardly lion asleep poppy bed dorothy glad friend cowardly lion asleep poppy bed rescued.then several mouse unharness truck scamper away grass several mouse 's home,[unused0] grow fond friend cowardly lion asleep poppy bed [unused0] glad friend cowardly lion asleep poppy bed rescued.then several mouse unharness truck scamper away grass several mouse 's home,[unused0],X,X
149,9,little gray field mouse several mouse last leave.if ever scarecrow need several mouse little gray field mouse say come field call several mouse shall hear scarecrow come scarecrow 's assistance,little gray field mouse several mouse last leave.if ever [unused1] need several mouse little gray field mouse say come field call several mouse shall hear [unused1] come [unused1] 's assistance,[unused1],X,X
150,9,scarecrow bring dorothy fruit tree near dorothy eat dorothy 's dinner,[unused1] bring [unused0] fruit tree near [unused0] eat [unused0] 's dinner,[unused1],X,X
151,10,people seem friendly munchkin scarecrow’m afraid shall unable find place pass night.i like something eat besides fruit say dorothy dorothy’m sure toto nearly starve,people seem friendly munchkin [unused1]’m afraid shall unable find place pass night.i like something eat besides fruit say dorothy dorothy’m sure toto nearly starve,[unused1],X,X
152,10,let stop next house talk people.so come goodsized farmhouse dorothy walk boldly door knocked.a woman open door far enough look say dorothy want dorothy great lion wish pass night woman woman allow answer dorothy,let stop next house talk people.so come goodsized farmhouse [unused0] walk boldly door knocked.a woman open door far enough look say [unused0] want [unused0] great lion wish pass night woman woman allow answer [unused0],[unused0],X,X
153,10,dorothy emerald city many time emerald city beautiful wonderful place,[unused0] emerald city many time emerald city beautiful wonderful place,[unused0],X,X
154,10,dorothy never permit see oz dorothy know live person see oz.does oz never go ask scarecrow.never,[unused0] never permit see oz [unused0] know live person see oz.does oz never go ask scarecrow.never,[unused0],authority.virtue,"permits,permit"
155,10,oz oz oz 's form live person tell.that strange say dorothy must try way see oz shall make journey nothing.why scarecrow wish see oz ask man.the scarecrow want oz give scarecrow brain say scarecrow eagerly.oh oz could give easily enough declare man,oz oz oz 's form live person tell.that strange say dorothy must try way see oz shall make journey nothing.why [unused1] wish see oz ask man.the [unused1] want oz give [unused1] brain say [unused1] eagerly.oh oz could give easily enough declare man,[unused1],X,X
156,10,first dorothy must get see oz get hard task,first [unused0] must get see oz get hard task,[unused0],X,X
157,10,strange say toto could speak.a woman call supper ready gather around table dorothy eat delicious porridge dish scrambled egg plate nice white bread enjoy delicious porridge dish scrambled egg plate nice white bread,strange say toto could speak.a woman call supper ready gather around table [unused0] eat delicious porridge dish scrambled egg plate nice white bread enjoy delicious porridge dish scrambled egg plate nice white bread,[unused0],X,X
158,10,scarecrow eat nothing,[unused1] eat nothing,[unused1],X,X
159,10,great wall surround city high thick bright green color.in front end road yellow brick big gate stud emerald glitter sun even paint eye scarecrow dazzle brilliancy.there bell beside great wall surround city dorothy push button hear silvery tinkle sound within,great wall surround city high thick bright green color.in front end road yellow brick big gate stud emerald glitter sun even paint eye [unused1] dazzle brilliancy.there bell beside great wall surround city dorothy push button hear silvery tinkle sound within,[unused1],X,X
160,10,first dorothy must put spectacles.why ask dorothy.because dorothy wear spectacle brightness glory emerald city would blind dorothy,first [unused0] must put spectacles.why ask [unused0].because [unused0] wear spectacle brightness glory emerald city would blind [unused0],[unused0],sanctity.virtue,"glories,glory"
161,10,pair would fit dorothy dorothy could take pair would fit dorothy dorothy wish course dorothy wish blind glare emerald city dorothy say nothing.then man fit spectacle scarecrow even toto,pair would fit [unused0] [unused0] could take pair would fit [unused0] [unused0] wish course [unused0] wish blind glare emerald city [unused0] say nothing.then man fit spectacle [unused1] even toto,[unused0],X,X
162,11,last soldier come back dorothy asked.have soldier see ozoh return soldier,last soldier come back [unused0] asked.have soldier see ozoh return soldier,[unused0],X,X
163,11,dorothy time open little green book dorothy find little green book full queer green picture make dorothy 's laugh queer green picture make laugh funny funny.in wardrobe many green dress make silk satin velvet,[unused0] time open little green book [unused0] find little green book full queer green picture make [unused0] 's laugh queer green picture make laugh funny funny.in wardrobe many green dress make silk satin velvet,[unused0],X,X
164,11,scarecrow find scarecrow alone scarecrow 's room scarecrow stand stupidly one spot within doorway wait till morning,[unused1] find [unused1] alone [unused1] 's room [unused1] stand stupidly one spot within doorway wait till morning,[unused1],X,X
165,11,would rest scarecrow lie scarecrow could close scarecrow 's eye,would rest [unused1] lie [unused1] could close [unused1] 's eye,[unused1],X,X
166,11,scarecrow remain night stare little spider weave little spider weave web corner room 's web corner room room one wonderful room world,[unused1] remain night stare little spider weave little spider weave web corner room 's web corner room room one wonderful room world,[unused1],X,X
167,11,dorothy enter many lady gentleman court dress rich costume look dorothy curiously one many lady gentleman court dress rich costume whispered.are dorothy really go look upon face oz terribleof course answer dorothy oz great wizard see dorothy.oh oz great wizard see dorothy say soldieroz great wizard although oz great wizard like people ask see oz great wizard,[unused0] enter many lady gentleman court dress rich costume look [unused0] curiously one many lady gentleman court dress rich costume whispered.are [unused0] really go look upon face oz terribleof course answer [unused0] oz great wizard see [unused0].oh oz great wizard see [unused0] say soldieroz great wizard although oz great wizard like people ask see oz great wizard,[unused0],X,X
168,11,dorothy must go throne room alone.she open little door dorothy walk boldly find dorothy wonderful place,[unused0] must go throne room alone.she open little door [unused0] walk boldly find [unused0] wonderful place,[unused0],X,X
169,11,dorothy dorothy seek awful voice dorothy expect come enormous head without body support arm leg whatever,[unused0] [unused0] seek awful voice [unused0] expect come enormous head without body support arm leg whatever,[unused0],sanctity.virtue,body
170,11,dorothy come help.the eye look dorothy thoughtfully full minute,[unused0] come help.the eye look [unused0] thoughtfully full minute,[unused0],X,X
171,11,say voice.where dorothy get silver shoesi get wicked witch east dorothy 's house fall wicked witch east kill wicked witch east dorothy replied.where dorothy get mark upon forehead continue voice.the mark upon forehead good witch north kiss dorothy good witch north bid dorothy goodbye send dorothy say dorothy.again eye look dorothy 's sharply eye see dorothy tell truth,say voice.where [unused0] get silver shoesi get wicked [unused2] east [unused0] 's house fall wicked [unused2] east kill wicked [unused2] east [unused0] replied.where [unused0] get mark upon forehead continue voice.the mark upon forehead good [unused2] north kiss [unused0] good [unused2] north bid [unused0] goodbye send [unused0] say [unused0].again eye look [unused0] 's sharply eye see [unused0] tell truth,[unused0],care.vice,"kill,kills"
172,11,dorothy like 's country although country beautiful,[unused0] like 's country although country beautiful,[unused0],loyalty.virtue,"countries,country"
173,11,dorothy sure aunt em dreadfully worry dorothy 's away long.the eye wink three time eye turn ceiling floor roll around queerly eye seem see every part big room green carpet lovely green furniture set emerald,[unused0] sure aunt em dreadfully worry [unused0] 's away long.the eye wink three time eye turn ceiling floor roll around queerly eye seem see every part big room green carpet lovely green furniture set emerald,[unused0],X,X
174,11,great wizard dorothy little girl.but dorothy strong enough kill wicked witch eastthe east say i.kill happen return dorothy simply,great wizard [unused0] little girl.but [unused0] strong enough kill wicked [unused2] eastthe east say i.kill happen return [unused0] simply,[unused0],care.vice,"kill,kills"
175,11,dorothy could help it.well say give dorothy 's answer,[unused0] could help it.well say give [unused0] 's answer,[unused0],care.virtue,"help,helps"
176,11,dorothy right expect send dorothy back kansas unless dorothy something return,[unused0] right expect send [unused0] back kansas unless [unused0] something return,[unused0],fairness.virtue,rights
177,11,help help dorothy.what must dorothy ask dorothy.kill wicked witch east answer i.but dorothy exclaim dorothy greatly surprised.i kill witch east dorothy wear silver shoe bear powerful charm,help help [unused0].what must [unused0] ask [unused0].kill wicked [unused2] east answer i.but [unused0] exclaim [unused0] greatly surprised.i kill [unused2] east [unused0] wear silver shoe bear powerful charm,[unused0],"care.vice,care.virtue","help,kill,kills,helps"
178,11,one wicked witch leave land dorothy tell wicked witch east dead send dorothy back kansas before.the little girl begin weep dorothy much disappointed,one wicked [unused2] leave land dorothy tell wicked [unused2] east dead send dorothy back kansas before.the little girl begin weep dorothy much disappointed,[unused2],X,X
179,11,eye wink look upon dorothy 's anxiously feel dorothy could help dorothy would.dorothy never kill anything willingly dorothy sob,eye wink look upon [unused0] 's anxiously feel [unused0] could help [unused0] would.[unused0] never kill anything willingly [unused0] sob,[unused0],"care.vice,care.virtue","help,kill,kills,helps"
180,11,even dorothy want could dorothy kill wicked witch east great terrible kill wicked witch east great terrible great terrible expect dorothy iti know say i.,even [unused0] want could [unused0] kill wicked [unused2] east great terrible kill wicked [unused2] east great terrible great terrible expect [unused0] iti know say i.,[unused0],care.vice,"kill,kills"
181,11,go ask see dorothy dorothy 's task.sorrowfully dorothy leave throne room go back lion scarecrow tin woodman wait hear say dorothy,go ask see [unused0] [unused0] 's task.sorrowfully [unused0] leave throne room go back lion [unused1] tin woodman wait hear say [unused0],[unused0],X,X
182,11,hope dorothy dorothy say sadly send dorothy home dorothy kill wicked witch eastthe witch,hope [unused0] [unused0] say sadly send [unused0] home [unused0] kill wicked [unused2] eastthe [unused2],[unused0],care.vice,"kill,kills"
183,11,kill dorothy never do.dorothy friend sorry could nothing help dorothy,kill [unused0] never do.[unused0] friend sorry could nothing help [unused0],[unused0],"care.vice,care.virtue","help,kill,kills,helps"
184,11,dorothy go dorothy 's room lie bed cry dorothy sleep.the next morning soldier come scarecrow said.come soldier send scarecrow.so scarecrow follow soldier admit throne room scarecrow see sit throne room young girl dress pretty green silk gown,[unused0] go [unused0] 's room lie bed cry [unused0] sleep.the next morning soldier come [unused1] said.come soldier send [unused1].so [unused1] follow soldier admit throne room [unused1] see sit throne room young girl dress pretty green silk gown,[unused1],care.vice,"crying,cries"
185,11,grow young girl dress pretty green silk gown 's shoulder wing gorgeous color light wing gorgeous color light flutter slight breath air reach flutter slight breath air reach wing gorgeous color light flutter slight breath air reach them.when scarecrow bow prettily scarecrow 's straw stuffing would let scarecrow young girl dress pretty green silk gown young girl dress pretty green silk gown look upon scarecrow sweetly said.i oz great terrible,grow young girl dress pretty green silk gown 's shoulder wing gorgeous color light wing gorgeous color light flutter slight breath air reach flutter slight breath air reach wing gorgeous color light flutter slight breath air reach them.when [unused1] bow prettily [unused1] 's straw stuffing would let [unused1] young girl dress pretty green silk gown young girl dress pretty green silk gown look upon [unused1] sweetly said.i oz great terrible,[unused1],X,X
186,11,scarecrow scarecrow seek menow scarecrowi much astonish,[unused1] [unused1] seek menow [unused1]i much astonish,[unused1],X,X
187,11,scarecrow answer young girl dress pretty green silk gown bravely.the scarecrow scarecrow stuff straw,[unused1] answer young girl dress pretty green silk gown bravely.the [unused1] [unused1] stuff straw,[unused1],X,X
188,11,therefore scarecrow brain scarecrow come pray put brain scarecrow 's head instead straw scarecrow may become much man 's dominions.why put scarecrow ask young girl dress pretty green silk gown.because young girl dress pretty green silk gown wise powerful one else help scarecrow answer scarecrow.i never grant favor without return say i.,therefore [unused1] brain [unused1] come pray put brain [unused1] 's head instead straw [unused1] may become much man 's dominions.why put [unused1] ask young girl dress pretty green silk gown.because young girl dress pretty green silk gown wise powerful one else help [unused1] answer [unused1].i never grant favor without return say i.,[unused1],"sanctity.virtue,care.virtue","help,pray,helps"
189,11,scarecrow kill wicked witch eastthe witch bestow upon scarecrow great many brain good brain scarecrow wise man land oz.i think ask dorothy kill wicked witch east say scarecrow surprise.so,[unused1] kill wicked [unused2] eastthe [unused2] bestow upon [unused1] great many brain good brain [unused1] wise man land oz.i think ask dorothy kill wicked [unused2] east say [unused1] surprise.so,[unused1],care.vice,"kill,kills"
190,11,wicked witch east dead grant scarecrow 's wish,wicked [unused2] east dead grant [unused1] 's wish,[unused2],X,X
191,11,go seek scarecrow earn brain scarecrow greatly desire.the scarecrow go sorrowfully back scarecrow 's friend tell friend say,go seek [unused1] earn brain [unused1] greatly desire.the [unused1] go sorrowfully back [unused1] 's friend tell friend say,[unused1],X,X
192,11,dorothy surprised find head dorothy see young girl dress pretty green silk gown.all say scarecrow young girl dress pretty green silk gown need heart much tin woodman.on next morning soldier come tin woodman said.i send tin woodman,[unused0] surprised find head [unused0] see young girl dress pretty green silk gown.all say [unused1] young girl dress pretty green silk gown need heart much tin woodman.on next morning soldier come tin woodman said.i send tin woodman,[unused0],X,X
193,11,wicked witch east dead come terrible beast terrible beast give tin woodman big kindest love heart land oz.so tin woodman force return sorrowfully tin woodman 's tell friend ithe tin woodman,wicked [unused2] east dead come terrible beast terrible beast give tin woodman big kindest love heart land oz.so tin woodman force return sorrowfully tin woodman 's tell friend ithe tin woodman,[unused2],care.virtue,"loves,love"
194,11,good cheer soldier 's yet well.the next morning soldier lead scarecrow throne room bid scarecrow enter presence i.the scarecrow pass door glance around saw scarecrow 's surprise throne room ball fire fierce glow scarecrow could scarcely bear gaze upon ball fire fierce glow could scarcely bear gaze upon,good cheer soldier 's yet well.the next morning soldier lead [unused1] throne room bid [unused1] enter presence i.the [unused1] pass door glance around saw [unused1] 's surprise throne room ball fire fierce glow [unused1] could scarcely bear gaze upon ball fire fierce glow could scarcely bear gaze upon,[unused1],X,X
195,11,scarecrow try go near heat intense heat singe scarecrow 's whisker scarecrow creep back tremblingly spot near door.then low quiet voice come ball fire fierce glow could scarcely bear gaze upon word ball fire fierce glow could scarcely bear gaze upon spoke.i oz great terrible,[unused1] try go near heat intense heat singe [unused1] 's whisker [unused1] creep back tremblingly spot near door.then low quiet voice come ball fire fierce glow could scarcely bear gaze upon word ball fire fierce glow could scarcely bear gaze upon spoke.i oz great terrible,[unused1],X,X
196,11,scarecrow scarecrow seek meand scarecrow answer scarecrow cowardly lion afraid everything,[unused1] [unused1] seek meand [unused1] answer [unused1] cowardly lion afraid everything,[unused1],X,X
197,11,scarecrow come beg give scarecrow courage reality scarecrow may become king beast man call scarecrow.why give scarecrow courage demand i.because wizard great alone power grant scarecrow 's request answer scarecrow.a ball fire fierce glow could scarcely bear gaze upon burn fiercely time voice say bring terrible beast proof wicked witch east dead moment terrible beast give scarecrow courage,[unused1] come beg give [unused1] courage reality [unused1] may become king beast man call [unused1].why give [unused1] courage demand i.because wizard great alone power grant [unused1] 's request answer [unused1].a ball fire fierce glow could scarcely bear gaze upon burn fiercely time voice say bring terrible beast proof wicked [unused2] east dead moment terrible beast give [unused1] courage,[unused1],X,X
198,11,long wicked witch east life scarecrow must remain coward.the lion angry speech could say nothing reply scarecrow stand silently gaze ball fire fierce glow could scarcely bear gaze upon ball fire fierce glow could scarcely bear gaze upon become furiously hot scarecrow turn tail rush throne room,long wicked [unused2] east life [unused1] must remain coward.the lion angry speech could say nothing reply [unused1] stand silently gaze ball fire fierce glow could scarcely bear gaze upon ball fire fierce glow could scarcely bear gaze upon become furiously hot [unused1] turn tail rush throne room,[unused1],X,X
199,11,scarecrow glad find scarecrow 's wait scarecrow tell friend scarecrow 's terrible interview i.what shall dorothy friend ask dorothy sadly.there one thing dorothy friend return scarecrow one thing go land winkie seek wicked witch east destroy wicked witch east.but suppose dorothy friend say dorothy.then lion shall never courage declare lion.and lion shall never brain add scarecrow.and shall never heart speak tin woodman.and dorothy shall never see aunt em uncle henry say dorothy begin cry.be careful cry young girl dress pretty green silk gown,[unused1] glad find [unused1] 's wait [unused1] tell friend [unused1] 's terrible interview i.what shall [unused0] friend ask [unused0] sadly.there one thing [unused0] friend return [unused1] one thing go land winkie seek wicked [unused2] east destroy wicked [unused2] east.but suppose [unused0] friend say [unused0].then lion shall never courage declare lion.and lion shall never brain add [unused1].and shall never heart speak tin woodman.and [unused0] shall never see aunt em uncle henry say [unused0] begin cry.be careful cry young girl dress pretty green silk gown,[unused1],care.vice,"crying,cries,destroy"
200,11,scarecrow shall much help dorothy scarecrow fool.i heart harm even witch remark tin woodman,[unused1] shall much help [unused0] [unused1] fool.i heart harm even [unused2] remark tin woodman,[unused1],"care.vice,care.virtue","help,harms,harm,helps"
201,11,scarecrow stuff scarecrow fresh straw dorothy put new paint scarecrow 's eye scarecrow might see well,[unused1] stuff [unused1] fresh straw dorothy put new paint [unused1] 's eye [unused1] might see well,[unused1],X,X
202,12,soldier green whisker unlock 's spectacle put spectacle back soldier green whisker 's great box soldier green whisker politely open gate them.which road lead wicked witch witch ask dorothy.there road answer guardian gate,soldier green whisker unlock 's spectacle put spectacle back soldier green whisker 's great box soldier green whisker politely open gate them.which road lead wicked [unused2] [unused2] ask dorothy.there road answer guardian gate,[unused2],X,X
203,12,one ever wish go way.how find wicked witch witch inquire dorothy.find easy reply man wicked witch witch know country winkie wicked witch witch find make wicked witch witch 's slaves.perhap say scarecrow mean destroy wicked witch witch.oh different say guardian gate,one ever wish go way.how find wicked [unused2] [unused2] inquire dorothy.find easy reply man wicked [unused2] [unused2] know country winkie wicked [unused2] [unused2] find make wicked [unused2] [unused2] 's slaves.perhap say [unused1] mean destroy wicked [unused2] [unused2].oh different say guardian gate,[unused2],"care.vice,loyalty.virtue","countries,destroy,country"
204,12,one ever destroy wicked witch witch guardian gate naturally think wicked witch witch would make slave wicked witch witch rest,one ever destroy wicked [unused2] [unused2] guardian gate naturally think wicked [unused2] [unused2] would make slave wicked [unused2] [unused2] rest,[unused2],"care.vice,authority.virtue","slaves,slave,destroy"
205,12,wicked witch witch wicked fierce may allow destroy wicked witch witch,wicked [unused2] [unused2] wicked fierce may allow destroy wicked [unused2] [unused2],[unused2],care.vice,destroy
206,12,keep witch fail find wicked witch witch.them thank guardian gate bid guardian gates goodbye turn toward witch walk field soft grass dot daisy buttercup,keep [unused2] fail find wicked [unused2] [unused2].them thank guardian gate bid guardian gates goodbye turn toward [unused2] walk field soft grass dot daisy buttercup,[unused2],X,X
207,12,night dorothy toto ’s scarecrow tired lie upon grass fall asleep woodman scarecrow keep watch.now wicked witch witch witch one eye yet one eye powerful telescope could see everywhere,night dorothy toto ’s [unused1] tired lie upon grass fall asleep woodman [unused1] keep watch.now wicked [unused2] [unused2] [unused2] one eye yet one eye powerful telescope could see everywhere,[unused1],X,X
