,chapter,text,mask_sent,char,mfd2,mfd_word
0,1,reach trap door middle floor ladder lead it.when dorothy stand doorway look around dorothy could see nothing great gray prairie every side,reach trap door middle floor ladder lead it.when [unused0] stand doorway look around [unused0] could see nothing great gray prairie every side,[unused0],X,X
1,1,dorothy first come aunt em farmer ’s wife aunt em farmer ’s wife startle dorothy laughter aunt em farmer ’s wife would scream press aunt em farmer ’s wife 's hand upon aunt em farmer ’s wife 's heart whenever dorothy 's merry voice reach aunt em farmer ’s wife 's ear,[unused0] first come aunt em farmer ’s wife aunt em farmer ’s wife startle [unused0] laughter aunt em farmer ’s wife would scream press aunt em farmer ’s wife 's hand upon aunt em farmer ’s wife 's heart whenever [unused0] 's merry voice reach aunt em farmer ’s wife 's ear,[unused0],loyalty.virtue,wife
2,1,first dorothy thought dorothy lose toto,first [unused0] thought [unused0] lose toto,[unused0],X,X
3,1,dorothy feel quite lonely wind shriek loudly dorothy dorothy nearly become deaf,[unused0] feel quite lonely wind shriek loudly [unused0] [unused0] nearly become deaf,[unused0],X,X
4,1,first dorothy wonder dorothy would dash piece house fall,first [unused0] wonder [unused0] would dash piece house fall,[unused0],X,X
5,2,one woman powerful woman rule one woman set people free one woman.but think witch wicked say,one woman powerful woman rule one woman set people free one woman.but think [unused2] wicked say,[unused2],X,X
6,2,four witch land oz two four witch live north south good witch,four [unused2] land oz two four [unused2] live north south good [unused2],[unused2],X,X
7,2,dwelt east witch indeed wicked witch,dwelt east [unused2] indeed wicked [unused2],[unused2],X,X
8,2,kill one dwelt east witch one wicked witch land oz one wicke witchthe witch.but say moment ’s think aunt em tell four witch dead year year ago.who aunt em inquire one woman.aunt em one woman 's aunt live kansas one woman come from.the witch north seem think time one woman 's head bow one woman 's eye upon ground,kill one dwelt east [unused2] one wicked [unused2] land oz one wicke [unused2]the [unused2].but say moment ’s think aunt em tell four [unused2] dead year year ago.who aunt em inquire one woman.aunt em one woman 's aunt live kansas one woman come from.the [unused2] north seem think time one woman 's head bow one woman 's eye upon ground,[unused2],care.vice,"kill,kills"
9,2,civilized country one woman believe witch leave wizard sorceresse magician,civilized country one woman believe [unused2] leave wizard sorceresse magician,[unused2],loyalty.virtue,"countries,country"
10,2,live city emeralds.she go ask another question munchkin stand silently give loud shout point corner house woman lying.what corner house wicked witch lie ask look begin laugh,live city emeralds.she go ask another question munchkin stand silently give loud shout point corner house woman lying.what corner house wicked [unused2] lie ask look begin laugh,[unused2],X,X
11,2,country winkie live rule wicked witch witch would make wicked witch witch would make slave pass way 's slave pass wicked witch witch would make slave pass way 's way.the north one woman 's home say one woman north 's edge great desert,country winkie live rule wicked [unused2] [unused2] would make wicked [unused2] [unused2] would make slave pass way 's slave pass wicked [unused2] [unused2] would make slave pass way 's way.the north one woman 's home say one woman north 's edge great desert,[unused2],"authority.virtue,loyalty.virtue","slaves,countries,slave,country"
12,2,one woman give friendly little nod whirl around one woman 's leave heel three time straightway disappear much surprise little toto bark one woman loudly enough one woman go afraid even growl stand by.but know one woman witch expect one woman disappear way surprised least,one woman give friendly little nod whirl around one woman 's leave heel three time straightway disappear much surprise little toto bark one woman loudly enough one woman go afraid even growl stand by.but know one woman [unused2] expect one woman disappear way surprised least,[unused2],X,X
13,3,dorothy leave alone dorothy begin feel hungry,[unused0] leave alone [unused0] begin feel hungry,[unused0],X,X
14,3,dorothy go get toto see delicious fruit hang branch dorothy gather find dorothy want help dorothy 's breakfast.then dorothy go back house help dorothy toto good drink clear sparkle water dorothy set make ready journey city emeralds.dorothy one dress one dress happen clean hang peg beside dorothy 's bed,[unused0] go get toto see delicious fruit hang branch [unused0] gather find [unused0] want help [unused0] 's breakfast.then [unused0] go back house help [unused0] toto good drink clear sparkle water [unused0] set make ready journey city emeralds.[unused0] one dress one dress happen clean hang peg beside [unused0] 's bed,[unused0],"sanctity.virtue,care.virtue","help,clean,helps,cleans"
15,3,dorothy take little basket fill little basket bread cupboard lay white cloth top,[unused0] take little basket fill little basket bread cupboard lay white cloth top,[unused0],X,X
16,3,toto look dorothy 's face toto 's little black eye wag toto 's tail show toto know dorothy meant.at moment dorothy see lie table silver shoe belong witch east.dorothy wonder silver shoe belong witch east fit dorothy dorothy say toto,toto look [unused0] 's face toto 's little black eye wag toto 's tail show toto know [unused0] meant.at moment [unused0] see lie table silver shoe belong [unused2] east.[unused0] wonder silver shoe belong [unused2] east fit [unused0] [unused0] say toto,[unused0],loyalty.virtue,belong
17,3,toto trotting along soberly behind dorothy dorothy start journey city emeralds.there several road nearby take dorothy long find one pave yellow brick,toto trotting along soberly behind [unused0] [unused0] start journey city emeralds.there several road nearby take [unused0] long find one pave yellow brick,[unused0],X,X
18,3,sun shine bright bird sing sweetly dorothy feel nearly bad might think little girl would suddenly whisk away country set midst strange land.dorothy surprised dorothy walk along see pretty country dorothy,sun shine bright bird sing sweetly [unused0] feel nearly bad might think little girl would suddenly whisk away country set midst strange land.[unused0] surprised [unused0] walk along see pretty country [unused0],[unused0],loyalty.virtue,"countries,country"
19,3,dorothy would pass house people come look dorothy bow low dorothy go,[unused0] would pass house people come look [unused0] bow low [unused0] go,[unused0],X,X
20,3,everyone know dorothy mean destroy witch east set everyone free bondage,everyone know [unused0] mean destroy [unused2] east set everyone free bondage,[unused0],care.vice,destroy
21,3,paint blue country east blue favorite color.toward evening dorothy tired dorothy 's long walk begin wonder dorothy pass night dorothy come house rather large rest,paint blue country east blue favorite color.toward evening [unused0] tired [unused0] 's long walk begin wonder [unused0] pass night [unused0] come house rather large rest,[unused0],loyalty.virtue,"countries,country"
22,3,besides dorothy white dorothy 's frock witch sorceress wear white.my dress blue white check say dorothy smooth wrinkle one dress.it kind dorothy wear one dress say rich munchkin whose name boq,besides [unused0] white [unused0] 's frock [unused2] sorceress wear white.my dress blue white check say [unused0] smooth wrinkle one dress.it kind [unused0] wear one dress say rich munchkin whose name boq,[unused0],X,X
23,3,know dorothy friendly witch.dorothy know say people seem think dorothy witch dorothy know well dorothy ordinary little girl come chance cyclone strange land.when dorothy tired watch dancing rich munchkin whose name boq lead dorothy housea room pretty bed,know [unused0] friendly [unused2].[unused0] know say people seem think [unused0] [unused2] [unused0] know well [unused0] ordinary little girl come chance cyclone strange land.when [unused0] tired watch dancing rich munchkin whose name boq lead [unused0] housea room pretty bed,[unused0],X,X
24,3,country rich pleasant dorothy must pass rough dangerous place dorothy reach end dorothy 's journey.this worry dorothy little dorothy know great oz could help dorothy get kansas dorothy bravely resolve turn back.dorothy bade dorothy 's friend goodbye start along road yellow brick,country rich pleasant [unused0] must pass rough dangerous place [unused0] reach end [unused0] 's journey.this worry [unused0] little [unused0] know great oz could help [unused0] get kansas [unused0] bravely resolve turn back.[unused0] bade [unused0] 's friend goodbye start along road yellow brick,[unused0],"loyalty.virtue,care.virtue","help,countries,helps,country"
25,3,dorothy go several mile dorothy think dorothy would stop rest climb top fence beside road yellow brick sit,[unused0] go several mile [unused0] think [unused0] would stop rest climb top fence beside road yellow brick sit,[unused0],X,X
26,3,foot old boot blue top every man wear country east scarecrow place high pole keep bird ripe corn raise stalk corn mean pole stick scarecrow place high pole keep bird ripe corn 's back.while dorothy look earnestly queer paint face scarecrow place high pole keep bird ripe corn dorothy surprised see one eye slowly wink dorothy,foot old boot blue top every man wear country east [unused1] place high pole keep bird ripe corn raise stalk corn mean pole stick [unused1] place high pole keep bird ripe corn 's back.while [unused0] look earnestly queer paint face [unused1] place high pole keep bird ripe corn [unused0] surprised see one eye slowly wink [unused0],[unused0],loyalty.virtue,"countries,country"
27,3,dorothy please take away pole stick back scarecrow place high pole keep bird ripe corn shall greatly oblige dorothy.dorothy reach arm lift scarecrow place high pole keep bird ripe corn pole stick back stuff straw scarecrow place high pole keep bird ripe corn quite light.thank dorothy much say scarecrow place high pole keep bird ripe corn scarecrow place high pole keep bird ripe corn set ground,[unused0] please take away pole stick back [unused1] place high pole keep bird ripe corn shall greatly oblige [unused0].[unused0] reach arm lift [unused1] place high pole keep bird ripe corn pole stick back stuff straw [unused1] place high pole keep bird ripe corn quite light.thank [unused0] much say [unused1] place high pole keep bird ripe corn [unused1] place high pole keep bird ripe corn set ground,[unused0],X,X
28,4,scarecrow brain scarecrow walk straight ahead step hole fall full length yellow brick uneven,[unused1] brain [unused1] walk straight ahead step hole fall full length yellow brick uneven,[unused1],X,X
29,4,never hurt scarecrow however dorothy would pick scarecrow set scarecrow upon scarecrow 's foot scarecrow join dorothy laugh merrily scarecrow 's mishap.the farm nearly well care farm far back,never hurt [unused1] however [unused0] would pick [unused1] set [unused1] upon [unused1] 's foot [unused1] join [unused0] laugh merrily [unused1] 's mishap.the farm nearly well care farm far back,[unused0],"care.vice,care.virtue","cares,care,hurt,hurts"
30,4,dorothy offer piece scarecrow scarecrow refused.the scarecrow never hungry scarecrow say lucky thing scarecrow scarecrow 's mouth paint scarecrow cut hole mouth scarecrow could eat straw scarecrow stuff would come straw stuff would spoil shape scarecrow 's head.dorothy see true dorothy nod go eat bread.tell scarecrow something dorothy country dorothy come say scarecrow dorothy finish dorothy 's dinner,[unused0] offer piece [unused1] [unused1] refused.the [unused1] never hungry [unused1] say lucky thing [unused1] [unused1] 's mouth paint [unused1] cut hole mouth [unused1] could eat straw [unused1] stuff would come straw stuff would spoil shape [unused1] 's head.[unused0] see true [unused0] nod go eat bread.tell [unused1] something [unused0] country [unused0] come say [unused1] [unused0] finish [unused0] 's dinner,[unused0],"loyalty.virtue,sanctity.vice","spoil,countries,country"
31,4,dorothy tell scarecrow country come gray everything cyclone carry dorothy queer land oz.the scarecrow listen carefully say scarecrow understand dorothy wish leave beautiful country go back country come from.that scarecrow brain answer dorothy,[unused0] tell [unused1] country come gray everything cyclone carry [unused0] queer land oz.the [unused1] listen carefully say [unused1] understand [unused0] wish leave beautiful country go back country come from.that [unused1] brain answer [unused0],[unused1],loyalty.virtue,"countries,country"
32,4,place like home.the scarecrow sighed.of course scarecrow understand scarecrow say,place like home.the [unused1] sighed.of course [unused1] understand [unused1] say,[unused1],X,X
33,4,dorothy 's head stuff straw like scarecrow dorothy would probably live beautiful place country come would people,[unused0] 's head stuff straw like [unused1] [unused0] would probably live beautiful place country come would people,[unused0],loyalty.virtue,"countries,country"
34,4,fortunate kansas scarecrow brains.won’t scarecrow tell scarecrow story rest ask scarecrow.the scarecrow look scarecrow reproachfully answered.the scarecrow life short scarecrow really know nothing whatever,fortunate kansas [unused1] brains.won’t [unused1] tell [unused1] story rest ask [unused1].the [unused1] look [unused1] reproachfully answered.the [unused1] life short [unused1] really know nothing whatever,[unused1],X,X
35,4,scarecrow make day yesterday,[unused1] make day yesterday,[unused1],X,X
36,4,luckily farmer make head one first thing farmer paint scarecrow 's ear scarecrow hear go,luckily farmer make head one first thing farmer paint [unused1] 's ear [unused1] hear go,[unused1],X,X
37,4,another munchkin farmer first thing scarecrow hear farmer say another munchkin like ears’‘they straight answer another munchkin ‘never mind say farmer,another munchkin farmer first thing [unused1] hear farmer say another munchkin like ears’‘they straight answer another munchkin ‘never mind say farmer,[unused1],X,X
38,4,farmer paint scarecrow 's right eye soon right eye finish scarecrow find scarecrow look farmer everything around scarecrow great deal curiosity scarecrow 's first glimpse world ‘that ’s rather pretty eye remark another munchkin,farmer paint [unused1] 's right eye soon right eye finish [unused1] find [unused1] look farmer everything around [unused1] great deal curiosity [unused1] 's first glimpse world ‘that ’s rather pretty eye remark another munchkin,[unused1],fairness.virtue,rights
39,4,scarecrow could see much well,[unused1] could see much well,[unused1],X,X
40,4,scarecrow speak time scarecrow know mouth,[unused1] speak time [unused1] know mouth,[unused1],X,X
41,4,scarecrow fun watch make scarecrow 's body scarecrow 's arm leg,[unused1] fun watch make [unused1] 's body [unused1] 's arm leg,[unused1],sanctity.virtue,body
42,4,fasten scarecrow 's head last scarecrow feel proud scarecrow think scarecrow good man anyone ‘this fellow scare crow fast enough say farmer,fasten [unused1] 's head last [unused1] feel proud [unused1] think [unused1] good man anyone ‘this fellow scare crow fast enough say farmer,[unused1],loyalty.virtue,"fellows,fellow"
43,4,scarecrow look like man ’‘why scarecrow man say another munchkin scarecrow quite agree farmer,[unused1] look like man ’‘why [unused1] man say another munchkin [unused1] quite agree farmer,[unused1],X,X
44,4,farmer carry scarecrow farmer 's arm cornfield set scarecrow tall stick scarecrow find scarecrow,farmer carry [unused1] farmer 's arm cornfield set [unused1] tall stick [unused1] find [unused1],[unused1],X,X
45,4,farmer another munchkin soon walk away leave scarecrow alone.the scarecrow like desert way,farmer another munchkin soon walk away leave [unused1] alone.the [unused1] like desert way,[unused1],X,X
46,4,scarecrow try walk friend,[unused1] try walk friend,[unused1],X,X
47,4,scarecrow 's foot would touch ground scarecrow force stay tall stick find,[unused1] 's foot would touch ground [unused1] force stay tall stick find,[unused1],X,X
48,4,tall stick find lonely life lead scarecrow nothing think make little,tall stick find lonely life lead [unused1] nothing think make little,[unused1],X,X
49,4,many crow bird fly cornfield soon many crow bird see scarecrow many crow bird fly away think scarecrow munchkin,many crow bird fly cornfield soon many crow bird see [unused1] many crow bird fly away think [unused1] munchkin,[unused1],X,X
50,4,please scarecrow make scarecrow feel scarecrow quite important person,please [unused1] make [unused1] feel [unused1] quite important person,[unused1],X,X
51,4,crow sense could see scarecrow stuff straw old crow hop foot eat corn old crow want,crow sense could see [unused1] stuff straw old crow hop foot eat corn old crow want,[unused1],X,X
52,4,bird see old crow harm scarecrow come eat corn want short time great flock scarecrow.the scarecrow feel sad show scarecrow good scarecrow,bird see old crow harm [unused1] come eat corn want short time great flock [unused1].the [unused1] feel sad show [unused1] good [unused1],[unused1],care.vice,"harm,harms"
53,4,old crow comfort scarecrow say scarecrow brain scarecrow 's head scarecrow would good man well man,old crow comfort [unused1] say [unused1] brain [unused1] 's head [unused1] would good man well man,[unused1],care.virtue,comfort
54,4,brain thing worth world matter whether one crow man ’after go scarecrow think decide scarecrow would try hard get brain,brain thing worth world matter whether one crow man ’after go [unused1] think decide [unused1] would try hard get brain,[unused1],X,X
55,4,good luck scarecrow come along pull scarecrow stake scarecrow say scarecrow sure great oz give scarecrow brain soon get emerald city.dorothy hope say dorothy earnestly since scarecrow seem anxious brains.oh yes,good luck [unused1] come along pull [unused1] stake [unused1] say [unused1] sure great oz give [unused1] brain soon get emerald city.dorothy hope say dorothy earnestly since [unused1] seem anxious brains.oh yes,[unused1],X,X
56,4,scarecrow anxious return scarecrow,[unused1] anxious return [unused1],[unused1],X,X
57,4,scarecrow know return scarecrow,[unused1] know return [unused1],[unused1],X,X
58,4,require brain figure scarecrow never say that.after hour light fade away find stumble along darkness,require brain figure [unused1] never say that.after hour light fade away find stumble along darkness,[unused1],X,X
59,4,dorothy could see toto could dog see well dark,[unused0] could see toto could dog see well dark,[unused0],X,X
60,4,scarecrow declare scarecrow could see well day,[unused1] declare [unused1] could see well day,[unused1],X,X
61,4,dorothy take hold scarecrow 's arm manage get along fairly well.if scarecrow see house place pass night dorothy say scarecrow must tell dorothy,dorothy take hold [unused1] 's arm manage get along fairly well.if [unused1] see house place pass night dorothy say [unused1] must tell dorothy,[unused1],X,X
62,4,uncomfortable walking dark.soon scarecrow stopped.i see little cottage right scarecrow say build log branch,uncomfortable walking dark.soon [unused1] stopped.i see little cottage right [unused1] say build log branch,[unused1],fairness.virtue,rights
63,4,scarecrow tired out.so scarecrow lead dorothy tree reach little cottage right dorothy enter find bed dry leave one corner,[unused1] tired out.so [unused1] lead dorothy tree reach little cottage right dorothy enter find bed dry leave one corner,[unused1],fairness.virtue,rights
64,4,scarecrow stand another corner wait patiently morning come,[unused1] stand another corner wait patiently morning come,[unused1],X,X
65,5,dorothy sit look around dorothy,[unused0] sit look around [unused0],[unused0],X,X
66,5,scarecrow still stand patiently scarecrow 's corner wait dorothy.we must go search water dorothy say scarecrow.why dorothy want water scarecrow asked.to wash dorothy 's face clean dust road drink dry bread stick dorothy 's throat.it must inconvenient make flesh say scarecrow thoughtfully dorothy must sleep eat drink,[unused1] still stand patiently [unused1] 's corner wait [unused0].we must go search water [unused0] say [unused1].why [unused0] want water [unused1] asked.to wash [unused0] 's face clean dust road drink dry bread stick [unused0] 's throat.it must inconvenient make flesh say [unused1] thoughtfully [unused0] must sleep eat drink,[unused1],"sanctity.virtue,sanctity.vice","flesh,clean,cleans"
67,5,however dorothy brain worth lot bother able think properly.they leave cottage walk tree find little spring clear water dorothy drink bathe eat dorothy 's breakfast,however [unused0] brain worth lot bother able think properly.they leave cottage walk tree find little spring clear water [unused0] drink bathe eat [unused0] 's breakfast,[unused0],X,X
68,5,dorothy saw much bread leave basket dorothy thankful scarecrow eat anything scarcely enough dorothy toto day.when dorothy finish dorothy 's meal go back road dorothy startled hear deep groan near by.what deep groan dorothy ask timidly.the scarecrow imagine reply scarecrow,[unused0] saw much bread leave basket [unused0] thankful [unused1] eat anything scarcely enough [unused0] toto day.when [unused0] finish [unused0] 's meal go back road [unused0] startled hear deep groan near by.what deep groan [unused0] ask timidly.the [unused1] imagine reply [unused1],[unused0],X,X
69,5,dorothy find oilcan shelf cottage.dorothy run back cottage find oilcan dorothy return ask anxiously 's jointsoil 's neck first reply,[unused0] find oilcan shelf cottage.[unused0] run back cottage find oilcan [unused0] return ask anxiously 's jointsoil 's neck first reply,[unused0],X,X
70,5,dorothy oil neck neck quite badly rust scarecrow take hold tin head move tin head gently side side tin head work freely could turn tin head his.now oil joint 's arm say,dorothy oil neck neck quite badly rust [unused1] take hold tin head move tin head gently side side tin head work freely could turn tin head his.now oil joint 's arm say,[unused1],X,X
71,5,dorothy oil joint arm scarecrow bent joint arm carefully joint arm quite free rust good new.his give sigh satisfaction lower uplifted axe.this great comfort say,dorothy oil joint arm [unused1] bent joint arm carefully joint arm quite free rust good new.his give sigh satisfaction lower uplifted axe.this great comfort say,[unused1],care.virtue,comfort
72,5,thank dorothy 's release seem polite creature grateful.his might stand always dorothy come along say,thank [unused0] 's release seem polite creature grateful.his might stand always [unused0] come along say,[unused0],authority.virtue,polite
73,5,dorothy happen herewe way emerald city see great oz dorothy answer stop cottage pass night.why dorothy wish see great oz asked.dorothy want great oz send dorothy back kansas scarecrow want scarecrow put brain scarecrow 's head dorothy replied.his appear think deeply moment,dorothy happen herewe way emerald city see great oz dorothy answer stop cottage pass night.why dorothy wish see great oz asked.dorothy want great oz send dorothy back kansas [unused1] want [unused1] put brain [unused1] 's head dorothy replied.his appear think deeply moment,[unused1],X,X
74,5,allow join 's party also go emerald city ask oz help his.come along say scarecrow heartily dorothy add dorothy would pleased scarecrow 's company,allow join 's party also go emerald city ask oz help his.come along say [unused1] heartily [unused0] add [unused0] would pleased [unused1] 's company,[unused0],"loyalty.virtue,care.virtue","help,company,companies,helps"
75,5,set work axe chop well soon clear passage party.dorothy think earnestly walk along dorothy notice scarecrow stumble hole roll side road,set work axe chop well soon clear passage party.[unused0] think earnestly walk along [unused0] notice [unused1] stumble hole roll side road,[unused0],X,X
76,5,indeed scarecrow oblige call dorothy help scarecrow again.why scarecrow walk around hole ask his.the scarecrow know enough reply scarecrow cheerfully,indeed [unused1] oblige call [unused0] help [unused1] again.why [unused1] walk around hole ask his.the [unused1] know enough reply [unused1] cheerfully,[unused1],care.virtue,"help,helps"
77,5,scarecrow 's head stuff straw know scarecrow go oz ask oz brains.oh see say,[unused1] 's head stuff straw know [unused1] go oz ask oz brains.oh see say,[unused1],X,X
78,5,try brain heart also much rather heart.and ask scarecrow.his tell scarecrow 's story scarecrow know.so walk forest tell story.i bear son woodman chop tree forest sell wood living,try brain heart also much rather heart.and ask [unused1].his tell [unused1] 's story [unused1] know.so walk forest tell story.i bear son woodman chop tree forest sell wood living,[unused1],X,X
79,5,oz go back one munchkin girl beautiful soon grow love heart marry one munchkin girl beautiful soon grow love heart.both dorothy scarecrow greatly interested story dorothy scarecrow know anxious get new heart.all say scarecrow scarecrow shall ask brain instead heart,oz go back one munchkin girl beautiful soon grow love heart marry one munchkin girl beautiful soon grow love heart.both [unused0] [unused1] greatly interested story [unused0] [unused1] know anxious get new heart.all say [unused1] [unused1] shall ask brain instead heart,[unused1],"sanctity.virtue,care.virtue","loves,love,marry"
